제목,날짜,작성일,작성자,댓글
김무성 “尹 신당론 뭘 모르는 소리…이재명·친문 동행 힘들것”,2021-04-24 00:03:00,2021-05-01 15:03:07,xhdd****,네넘은 뭘 아는게 있나? 너는 네넘의 하루 앞날도 모르는 넘 아니더냐?
"文 부정평가 59%로 최고…차기주자, 이재명 25% 윤석열 22%",2021-04-22 12:52:00,2021-05-14 02:40:28,osy8****,"청문회 한번봅시다 국민들에게 온갓 망신을 다주고 임명한다,이게나라맞읍니키"
"文 부정평가 59%로 최고…차기주자, 이재명 25% 윤석열 22%",2021-04-22 12:52:00,2021-05-07 02:14:09,moon****,위의 여론기관중 특별한 곳은 한곳정도? 그것도 네곳이 합쳐 1000여명 응답? 그 표본의 일관성과 신뢰도가 얼마나 되겠나? 여론 조사의 초보자 들도 이런 조사는 헛거라고 말할 지경이다 * 앞으로 이런 짓 하지 마~ 이게 뭐냐?
"文 부정평가 59%로 최고…차기주자, 이재명 25% 윤석열 22%",2021-04-22 12:52:00,2021-04-24 17:46:11,ad81****,A4용지의 마왕 우리이니
"文 부정평가 59%로 최고…차기주자, 이재명 25% 윤석열 22%",2021-04-22 12:52:00,2021-04-23 17:33:55,황****,관리자에 의해 삭제된 댓글입니다.
"文 부정평가 59%로 최고…차기주자, 이재명 25% 윤석열 22%",2021-04-22 12:52:00,2021-04-23 14:51:32,jemi****,"차기주자 논 하지 말라 쓰레기 언론아., ,니들 눈에 차는 거지같은 정치 푸락치 보다 훨 뛰어난 지도자가 있다 허경영의 강력한 지도력이 이 나라를 바로 세울 것이다 국민을 위한 33정책이 뭔지 모르는 언론 쓰레기들은 앞으로 폐간 될 것이고 국민기만한 방송사는 폐업된다 대통령될 지도자는 허경영 뿐이다"
"文 부정평가 59%로 최고…차기주자, 이재명 25% 윤석열 22%",2021-04-22 12:52:00,2021-04-23 11:00:33,김****,대한민국의 인물이 이렇게도 없나~?
"文 부정평가 59%로 최고…차기주자, 이재명 25% 윤석열 22%",2021-04-22 12:52:00,2021-04-23 09:20:10,ever****,깜방에서 보자 잘가라 짜이찌엔
"文 부정평가 59%로 최고…차기주자, 이재명 25% 윤석열 22%",2021-04-22 12:52:00,2021-04-23 08:49:12,권****,"하~ 답답한대한민국국민여러분! 제~발이제는정신좀차리이쇼~그동안,한번은좌파,한번은우파해봤으면이번에는이런거다집어치우고정말로우리국민한테바로바로해주는대통령을뽑도록합시다!"
"文 부정평가 59%로 최고…차기주자, 이재명 25% 윤석열 22%",2021-04-22 12:52:00,2021-05-10 16:56:53,Just****,이재명씨 어떻습니까?!!!
"文 부정평가 59%로 최고…차기주자, 이재명 25% 윤석열 22%",2021-04-22 12:52:00,2021-04-22 21:20:04,jhy7****,59% 밖에 안된다구요?
윤석열 51.1% 이재명 32.3%…윤석열 51.6% 이낙연 30.1% [리얼미터],2021-04-19 11:35:00,2021-04-20 15:31:42,임****,리얼미터 그걸 누가믿는다고 발표을하냐
윤석열 51.1% 이재명 32.3%…윤석열 51.6% 이낙연 30.1% [리얼미터],2021-04-19 11:35:00,2021-04-20 07:46:15,okle****,지금 처럼 권력을 이용한 탈법 불법이 자행되지 말고 법에 의한 질서가 회복되는 나라가 되기를 기원합니다 인권 변호사라는 사람이 법을 우습게 보는거 보고 권력이 참 무섭다는 생각입니다
윤석열 51.1% 이재명 32.3%…윤석열 51.6% 이낙연 30.1% [리얼미터],2021-04-19 11:35:00,2021-04-20 03:03:19,ogeu****,더러번당 대문 닫어라 쪽까지 말고
윤석열 51.1% 이재명 32.3%…윤석열 51.6% 이낙연 30.1% [리얼미터],2021-04-19 11:35:00,2021-04-19 19:22:26,김****,윤석열 총장님 적극 지지합니다 .
윤석열 51.1% 이재명 32.3%…윤석열 51.6% 이낙연 30.1% [리얼미터],2021-04-19 11:35:00,2021-04-19 19:04:23,Abra****,검찰이 대통령?. 배은망덕한 인간이?
윤석열 51.1% 이재명 32.3%…윤석열 51.6% 이낙연 30.1% [리얼미터],2021-04-19 11:35:00,2021-04-20 08:41:08,?****,뻔뻔당이 멀 해 주고 배은망덕이게 뻑하면 배은망덕이래 무식하게 대깨문들은 지들이 신이라 생각하나 문재인교주가 믿는 대깨문신
윤석열 51.1% 이재명 32.3%…윤석열 51.6% 이낙연 30.1% [리얼미터],2021-04-19 11:35:00,2021-04-20 08:18:51,mjpa****,인권변호사 대통령은 어떠신가?
윤석열 51.1% 이재명 32.3%…윤석열 51.6% 이낙연 30.1% [리얼미터],2021-04-19 11:35:00,2021-04-19 19:02:33,leee****,이재명....먼지 탈탈 털린상태 윤석열....먼지 아직 털 준비중 결국 누가 되겠나.......
윤석열 51.1% 이재명 32.3%…윤석열 51.6% 이낙연 30.1% [리얼미터],2021-04-19 11:35:00,2021-04-20 08:43:01,?****,총장시절 탈탈 털었지 더 나올게 있었으면 대깨문들이 가만히 있었을까
윤석열 51.1% 이재명 32.3%…윤석열 51.6% 이낙연 30.1% [리얼미터],2021-04-19 11:35:00,2021-04-19 16:18:25,dla8****,기레기들 윤대통령께 충성!
윤석열 51.1% 이재명 32.3%…윤석열 51.6% 이낙연 30.1% [리얼미터],2021-04-19 11:35:00,2021-04-19 15:50:27,good****,윤석열이 국민의짐에 들어가야 가능한 일이다.
윤석열 51.1% 이재명 32.3%…윤석열 51.6% 이낙연 30.1% [리얼미터],2021-04-19 11:35:00,2021-04-20 08:19:54,mjpa****,국민의짐이라고 하지 마세요. 이죄명이 말한 거에요.
윤석열 51.1% 이재명 32.3%…윤석열 51.6% 이낙연 30.1% [리얼미터],2021-04-19 11:35:00,2021-04-19 15:18:03,bsks****,관리자에 의해 삭제된 댓글입니다.
윤석열 51.1% 이재명 32.3%…윤석열 51.6% 이낙연 30.1% [리얼미터],2021-04-19 11:35:00,2021-04-19 15:07:59,이****,박범개는 윤석열 총장에게 살려주세요 하며 싹싹 빌어라. 혹시 아나? 옛 정을 생각해서 살려줄지? 범개야 니도 참 안되었다. 우찌 감투를 써도 꼭 요런 시기에 고런 감투쓰고 고따위 싸기지 없는 일을 했뿌렸냐?
윤석열 51.1% 이재명 32.3%…윤석열 51.6% 이낙연 30.1% [리얼미터],2021-04-19 11:35:00,2021-04-19 19:23:26,김****,그런날이 꼭 오리라 믿습니다 .
윤석열 51.1% 이재명 32.3%…윤석열 51.6% 이낙연 30.1% [리얼미터],2021-04-19 11:35:00,2021-04-19 14:59:34,nws5****,"현 정권을 하루속히 바꾸라는 국민의 의견이라고 보입니다,,"
윤석열 51.1% 이재명 32.3%…윤석열 51.6% 이낙연 30.1% [리얼미터],2021-04-19 11:35:00,2021-04-19 14:56:19,spar****,"소주성, 탈원전, 부동산실패, 세금수탈, 중국몽, 친북정책 등의 실정을 단죄할 수만 있으면 그게 윤석열 아니라 그 누구라도 상관치 않는다."
윤석열 51.1% 이재명 32.3%…윤석열 51.6% 이낙연 30.1% [리얼미터],2021-04-19 11:35:00,2021-04-19 14:40:30,siki****,ㅋㅋ 죄명이는 홍어와 대깨문들 밖에 없네
윤석열 51.1% 이재명 32.3%…윤석열 51.6% 이낙연 30.1% [리얼미터],2021-04-19 11:35:00,2021-04-19 14:26:42,jaco****,윤석열 빨리 나와라 국힘과 힘 합치자
윤석열 51.1% 이재명 32.3%…윤석열 51.6% 이낙연 30.1% [리얼미터],2021-04-19 11:35:00,2021-04-19 14:09:43,rjtk****,밑에 정신나간 꼴통은 이스라엘과 우리나라에 대한 미국의 입장차이조차 구분 못하는 한심한 놈이니 저런 헛소리나 주절대는게지.
[고정애의 직격인터뷰] “당 밖에서 사람 끌어오다 오합지졸 만들면 혼란만 와”,2021-04-09 00:48:00,2021-04-10 14:05:21,ybhd****,"대한민국의 수치. 언론의 종양. 언검유착 범죄자. 일본의 성노리개. 일본극우 언검유착 홍석현의 중앙일본, 성범죄와 해외불법비자금 조성. 유료부수조작 방상훈과 방정오의 조선일본. 777억 금융사기범 윤석열과 66억 3300만원 국민세금 아들딸 입시비리로 쓴 나경원. 300명 살인마 황교안까지. 사악한 악마들로부터 국민과 국가의 민주주의를 위한 개혁을 위해 고군분투하시는 것 수고 많으십니다. 끝까지 견뎌주십시요. 자살 당하지 마십시요. 언검유착 범죄자. 싸이코패스 조중동 기자들의 펜이 춤을 추더라도 결코 포기누 안됩니다!!"
[고정애의 직격인터뷰] “당 밖에서 사람 끌어오다 오합지졸 만들면 혼란만 와”,2021-04-09 00:48:00,2021-04-10 05:49:41,윤****,"국힘당은 차기집권에만 욕심이 있지, 집권후 어떤 나라를 만들겠단 구체적 비전제시도 없다. 정부가 하는 일에 반대만 해온 습성 때문이다. 대권후보도 없다.윤석열에만 욕심을 낸다. 지난 대선에서 2위한 홍준표가 복당을 호소해도 완강한 거절이다. 김종인 다음으로 주호영도 원내대표직을 내려놓아야 한다.홍준표릏 대선후보로 추대해야 이재명과 대결할 가능성과 집권당의 빛을 찾게 될것이다 ㅡ"
[고정애의 직격인터뷰] “당 밖에서 사람 끌어오다 오합지졸 만들면 혼란만 와”,2021-04-09 00:48:00,2021-04-09 17:10:54,kyds****,관리자에 의해 삭제된 댓글입니다.
[고정애의 직격인터뷰] “당 밖에서 사람 끌어오다 오합지졸 만들면 혼란만 와”,2021-04-09 00:48:00,2021-04-09 16:35:10,kyds****,관리자에 의해 삭제된 댓글입니다.
[고정애의 직격인터뷰] “당 밖에서 사람 끌어오다 오합지졸 만들면 혼란만 와”,2021-04-09 00:48:00,2021-04-09 16:34:36,kyds****,관리자에 의해 삭제된 댓글입니다.
[고정애의 직격인터뷰] “당 밖에서 사람 끌어오다 오합지졸 만들면 혼란만 와”,2021-04-09 00:48:00,2021-04-09 15:38:32,2015****,"이 분의 주장은 독일 석사 수준에 꼭 맞는 정도다. 그 이상은 전혀 아니라고 본다. 대한민국헌법을 개정해서 대통령제를 의원내각제로 하자는 것은 본인의 입장에서 정당 비대위원장을 해본 경험을 기초삼아 집권을 해보고자 하는 야욕에서 나온 주장일 뿐이다. 스스로 반추해 보면 알 것이다. 정당에서도 비대위원장이라는 비정상적 독임 직위를 누리니 어느 정도의 성과를 얻은 것이지, 의원내각제 방식의 정상적인 정당 체제라면 결코 어떤 성과도 얻지 못하고, 중구난방의 정당활동을 하다가 끝났을 것이다. 대표적인 사례가 홍준표의 경우다. 정상적인 당 대표가 되었으나, 비대위원장처럼 독임적 대표가 되지 못하니, 최고위원들에게 이러저리 끌려다니다가 침몰한 것이다. 정당에서도 그런데, 하물며 의원내각제 정부형태라면 어떻게 될 지는 이미 우리가 충분히 체험했다. 제2공화국을 파멸시킨 군사쿠테타로 인한 제3공화국 탄생을 통해서 말이다. 그런데 또 다시 그것을 되풀이 하자고 하는 것은 매우 잘못된 처사라고 본다."
[고정애의 직격인터뷰] “당 밖에서 사람 끌어오다 오합지졸 만들면 혼란만 와”,2021-04-09 00:48:00,2021-04-09 14:49:24,warm****,김위원장 말씀에 동감입니다 쓰레기 모으지 마시고 자생하시길 바랍니다 홍준표 김문수(나사가 빠지고 뇌새포가 많이 죽은 것같아 미친 목사 따라 다니고) 받아 들이지 말고 쓸모없고 갈데없는 안철수도 버리세요 드러눕은 꼴통 나경원도 도태시키고 새로운 바람으로 중도보수를 지향하세요
[고정애의 직격인터뷰] “당 밖에서 사람 끌어오다 오합지졸 만들면 혼란만 와”,2021-04-09 00:48:00,2021-04-09 14:44:06,ehwn****,보수정당 국민의힘엔 김종인대표는 당분간 좀더 보수정당을 책임져야하는거 아닌지본다 문재인정부도 하반기를 얼마안남은현실인데 더구나 가장크고중요했던 서울과부산시장도 기대이상성과이뤘으니 이때구심점이 갑자기 흩트러지거나하면 누구나다알 바로 또다시 당권싸움으로 이번 서울과 부산시장의 성과도 그냥 곤두박 와장창 깨질건 누구라도 다예측되는거아니냔거다 어디 1~2번였냐? 박근혜대통때도 그난리통으로 결국탄핵까지만들어놨는데 그버릇 어디갈건지~같아서다 무엇보다 현재대표될 우두머리보수정치인이 누군가? 그래서 또외부에서찾나? 그와중에 역시나매번그대로갈려 난리통벌일건 90도아닌 100%일건데 지금보수정당으론 당분간 김종인대표로 가야한다봐진다
[고정애의 직격인터뷰] “당 밖에서 사람 끌어오다 오합지졸 만들면 혼란만 와”,2021-04-09 00:48:00,2021-04-09 13:43:09,金****,123
[고정애의 직격인터뷰] “당 밖에서 사람 끌어오다 오합지졸 만들면 혼란만 와”,2021-04-09 00:48:00,2021-04-09 12:38:11,ys k****,영감 잘떠났소 이제부터 국짐당 내부에서 잡음이 끊이지 않을거요
[고정애의 직격인터뷰] “당 밖에서 사람 끌어오다 오합지졸 만들면 혼란만 와”,2021-04-09 00:48:00,2021-04-09 11:42:29,sung****,여야 모두 대통령 감이 없으니’ ‘그래서 내가 할 수 밖에 없다’로 들린다 더욱이 나는 ‘임기를 2년으로 줄이는 내각제 개헌 대통령으로는 최적화 된 대선 후보다’로 읽으면 무리가 없겠다
[고정애의 직격인터뷰] “당 밖에서 사람 끌어오다 오합지졸 만들면 혼란만 와”,2021-04-09 00:48:00,2021-04-09 11:33:18,sung****,‘밖을 그리워 말라’ 내부를 다지라’ 김종인’이 정당 지도자로서 얼마나 무개념 정치 중개인 인지의 반증이다 지난 1 년 국민힘은 ‘동굴 속 정치 구락부’였다 자유 개방 언로가 보장됐다면 지금쯤은 대선후보가 부상 했을 것. 누가 장애물 이었는가 배제의 정치로 ‘자기 정치’에 몰두하다 떠나면서 후보 군들의 노력 부족 탓만 하니 이것 또한 내로남불이다
[고정애의 직격인터뷰] “당 밖에서 사람 끌어오다 오합지졸 만들면 혼란만 와”,2021-04-09 00:48:00,2021-04-09 10:39:56,권****,김종인과 이해찬의 끝없는 야욕이 한국 정치와 정당을 엉망으로 만들어 놓았다 조중동 족벌 사주 포함
[고정애의 직격인터뷰] “당 밖에서 사람 끌어오다 오합지졸 만들면 혼란만 와”,2021-04-09 00:48:00,2021-04-09 09:22:12,Easy****,뼈를 깍는 혁신? 무뇌당이 무슨 혁신을 했지? 내가 쓴다면 '국민의 힘이 가장 어려울 때 중책을 맡으셔서 여당의 오만과 광기로 패착의 구렁텅이에서 허우적 거릴 때 야권 후보 단일화를 통해 어쩌구 저쩌구...'
[고정애의 직격인터뷰] “당 밖에서 사람 끌어오다 오합지졸 만들면 혼란만 와”,2021-04-09 00:48:00,2021-04-09 09:05:20,july****,"정말 이것들은 안되겠다...내년 대선이 국가의 향방을 가르는 중대선거인데 기본적인 조건은 국민의 짐의 쇄신이다. 송언석이 같은 놈을 비서실장으로 두고 막대기보다 못한 오세훈을 밀어제낀 김종인은 이제 그만 퇴장해라. 대다수의 양식있는 사람은 안철수,진중권,금태섭과 몇몇 젊은 인재와 함께 윤석열을 후보로 함께 가는게 유일한 답이다. 김무성,주호용등 구태는 모두 버리고 진짜만 델고 가야한다. 그걸 못하면 민주당보다 나을게 별로 없다. 백전필패다. 국가보다 대선보다 지들끼리 스크럼짜서 살려고 할게 뻔한데 걱정이다"
[고정애의 직격인터뷰] “당 밖에서 사람 끌어오다 오합지졸 만들면 혼란만 와”,2021-04-09 00:48:00,2021-04-09 08:00:31,dant****,관리자에 의해 삭제된 댓글입니다.
[고정애의 직격인터뷰] “당 밖에서 사람 끌어오다 오합지졸 만들면 혼란만 와”,2021-04-09 00:48:00,2021-04-09 07:33:26,jj82****,차기 당대표는 서울시장 같이 국민경선으로 쿨하게 갑시다
[고정애의 직격인터뷰] “당 밖에서 사람 끌어오다 오합지졸 만들면 혼란만 와”,2021-04-09 00:48:00,2021-04-09 05:34:37,Hee-****,"""내 힘으로 다 이룬거야"" ""윤석렬도 별거 없어"" ""나만한 사람 없어"" 그렇게 들리네"
[고정애의 직격인터뷰] “당 밖에서 사람 끌어오다 오합지졸 만들면 혼란만 와”,2021-04-09 00:48:00,2021-04-09 04:53:30,조****,"그렇다. 옳은 지적이다.. 야당을 풍지박산을 만들어놓고, 도망간 찌질이들을 다시 불러들이는건 절대 반대이다... 또다시 파벌싸움의 난장판이 될 뿐이다... 집권당이 가장 바라는 시나리오이다.. 한번 손절했던 인물들을 다시 당에 발을 들이지 마라.. 국민의힘은 새로운 인물, 새로운 정책으로 2030세대의 지지를 유지해 나가야 대선에 승리할수 있다... 새 술은 새부대에... 그게 정답이다..."
[고정애의 직격인터뷰] “당 밖에서 사람 끌어오다 오합지졸 만들면 혼란만 와”,2021-04-09 00:48:00,2021-04-09 04:48:13,이****,맞는말씀 유승민 김무성 기회주의자들이 전면에 서면 당의 분란만 가져오게된다 정계 은퇴를 하는것이 답이다 홍준표는 이미안되는걸로 검증이 끝났으며 자기만생각하는 비겁자이다
"윤석열, 대선주자 지지율 34%…충청권선 3배 뛰었다 [리얼미터]",2021-03-30 00:02:00,2021-03-30 18:55:47,국****,윤총장 잘정비해서 조속히 비상식을 상식으로 돌려놔 주세요. 그리고 반드시 대한민국을 좀먹는 쓰래기들 청소해 주세요
"윤석열, 대선주자 지지율 34%…충청권선 3배 뛰었다 [리얼미터]",2021-03-30 00:02:00,2021-03-30 18:22:55,hoho****,"말도 안 됨, 얼마나 인물이 없음 이런 자가... 슬프다. 울나라 현실이."
"윤석열, 대선주자 지지율 34%…충청권선 3배 뛰었다 [리얼미터]",2021-03-30 00:02:00,2021-03-30 12:30:55,아르****,관리자에 의해 삭제된 댓글입니다.
"윤석열, 대선주자 지지율 34%…충청권선 3배 뛰었다 [리얼미터]",2021-03-30 00:02:00,2021-03-30 11:09:21,eg65****,윤총장님을 대통령으로 무너진 대한민국 를 다시 세우자.
"윤석열, 대선주자 지지율 34%…충청권선 3배 뛰었다 [리얼미터]",2021-03-30 00:02:00,2021-03-30 10:32:01,scko****,충청도도 이제 대통령 한번 내보자는 심리인가? 사람아닌 법에 충성 한다는 사람이 대통령 되면 그야 말로 적폐청산 제대로 하겠네. 국정농단 사법농단 권력 남용 공문서 위조 모두 찾아 처벌하면 감옥이 넘쳐날지도...
"윤석열, 대선주자 지지율 34%…충청권선 3배 뛰었다 [리얼미터]",2021-03-30 00:02:00,2021-03-30 18:24:22,hoho****,그리고 정권 바뀌면 윤~도 감옥가고..
"윤석열, 대선주자 지지율 34%…충청권선 3배 뛰었다 [리얼미터]",2021-03-30 00:02:00,2021-03-30 10:05:43,good****,명박이의 BBK 비디오 증거가 있음에도 국민들이 그를 지지했던 것처럼 윤석렬의 불법 그의 마누라 장모의 불법이 하늘을 찌를 듯 한데도 석렬이를 지지하는 것은 또 다시 망조의 나라로 가는 지름길이로다 돈 만 밝히고 돈 만 있으면 그것이 최고로 타인이 죽어 가는 타인이 병들러 가든 나의 뱃돼아지에 비계만 채우겠다는 심보로 석렬이를 모시고자 하는 국민들의 수준이 그 어떠한 것인지 말해 주고 있다 불법과 비리덩어리인 그 악마의 입술에 키스하고자 영혼을 팔고자 하는 자들은 앞으로 다가올 나라의 구렁텅이를 예측 못하고 있는 것이 아닐까 걱정된다 음흉한 충청도인의 표본이 석렬이다 석렬이는 청문회에서 왈 정치의 문외인이며 정치는 모른다고 떠 벌인자이다 바로 그 자가 아주 정치 모략배의 모습을 거울에 비춰주고 있는 중이다
"윤석열, 대선주자 지지율 34%…충청권선 3배 뛰었다 [리얼미터]",2021-03-30 00:02:00,2021-03-30 11:10:34,eg65****,에라이 떨거지.문씨가 주는 밥 잘 먹고 다니시는지.그건 국민들의 혈세다.
"윤석열, 대선주자 지지율 34%…충청권선 3배 뛰었다 [리얼미터]",2021-03-30 00:02:00,2021-03-30 09:36:56,keun****,충청도는 단결심이 없는 도이다 여기저기 김종필이 김대중과 손잡고 김대중을 대통령만든 괴물이다 이번에는 제대로 하라
"윤석열, 대선주자 지지율 34%…충청권선 3배 뛰었다 [리얼미터]",2021-03-30 00:02:00,2021-03-30 09:33:50,?****,가소롭다!
"윤석열, 대선주자 지지율 34%…충청권선 3배 뛰었다 [리얼미터]",2021-03-30 00:02:00,2021-03-30 09:29:22,jkry****,윤석열을 어떻게 지지하나 온갖비리의혹이 이는데 이런기사는 좀 대다수 여론을 반영하지 않아보인다 그저 언론사의 논조?
"윤석열, 대선주자 지지율 34%…충청권선 3배 뛰었다 [리얼미터]",2021-03-30 00:02:00,2021-03-30 08:56:35,hjay****,충청 대통령 나와야 동서문제 해결된다. 해골은 세종시 인근에 빨리 묻어버리고.
"윤석열, 대선주자 지지율 34%…충청권선 3배 뛰었다 [리얼미터]",2021-03-30 00:02:00,2021-03-30 08:54:41,duse****,제발! 누구라도 나라를 정상으로 회복시켜 준다면/ 내 삶의 영원한 영웅입니다/
"윤석열, 대선주자 지지율 34%…충청권선 3배 뛰었다 [리얼미터]",2021-03-30 00:02:00,2021-03-30 08:24:15,mi****,"이러다간 윤석열 마저도 지역주의를 등에 업게 되나? 본인이 원하든 원치 않든... 우리나라 언제까지 이럴까? 서로 다른 인종이 섞여사는 것도 아닌데... 연고지에 기반한 집단이기주의가 아무렇지도 않게 표출된다. 자성은 커녕, 부끄러움도 모른다. 지역주의와 관련해서는 호남이 피해 집단이다. 다만 지역주의에 대해 지역주의로 대응하면 끝없는 갈등만 이어지니..."
"윤석열, 대선주자 지지율 34%…충청권선 3배 뛰었다 [리얼미터]",2021-03-30 00:02:00,2021-03-30 07:57:26,lee2****,이제 충청의 대통령이 호수의남쪽은 절대로 경상도도 많이 했고...
"윤석열, 대선주자 지지율 34%…충청권선 3배 뛰었다 [리얼미터]",2021-03-30 00:02:00,2021-03-30 07:47:28,song****,관리자에 의해 삭제된 댓글입니다.
"윤석열, 대선주자 지지율 34%…충청권선 3배 뛰었다 [리얼미터]",2021-03-30 00:02:00,2021-03-30 07:26:12,jame****,지금은 다 부질없다.. 석열이 정치판에 오고부터가 진짜야
"윤석열, 대선주자 지지율 34%…충청권선 3배 뛰었다 [리얼미터]",2021-03-30 00:02:00,2021-03-30 07:21:47,윤****,이재명이의 표풀리즘선동만 정책적으로 잘막아내면 국민들의 별이되는순간이 올것이다
"윤석열, 대선주자 지지율 34%…충청권선 3배 뛰었다 [리얼미터]",2021-03-30 00:02:00,2021-03-30 06:58:39,kbjh****,북한공산당. 민주당 없는 곳에 살고 싶다
"윤석열, 대선주자 지지율 34%…충청권선 3배 뛰었다 [리얼미터]",2021-03-30 00:02:00,2021-03-30 18:25:38,hoho****,이민가세요.
"사면 공론화 거론했던 김부겸 ""말못해""···그뒤엔 이낙연 효과?",2021-04-19 18:18:00,2021-04-19 23:56:15,Kyu ****,사면하지마라 문재인이 감옥에서 5년이상보내는 꼴 꼭보아야 하겠다
"사면 공론화 거론했던 김부겸 ""말못해""···그뒤엔 이낙연 효과?",2021-04-19 18:18:00,2021-04-19 19:05:40,오****,관리자에 의해 삭제된 댓글입니다.
"지지율 1위 윤석열, 비호감 1위도 윤석열…秋 아슬아슬 2위 [리얼미터]",2021-04-13 21:16:00,2021-04-15 12:36:18,이****,%로따져보면 이재명이 더높음 ㅋ
"지지율 1위 윤석열, 비호감 1위도 윤석열…秋 아슬아슬 2위 [리얼미터]",2021-04-13 21:16:00,2021-04-15 12:35:02,이****,기존정치인들도 윤총장님만큼만해도 나라가 번영할거다~~~ 차기 대통은 윤석열만한 인물 없는거같다!!
"지지율 1위 윤석열, 비호감 1위도 윤석열…秋 아슬아슬 2위 [리얼미터]",2021-04-13 21:16:00,2021-04-14 17:10:05,김****,국민들한테는지지율1위이고문빠순이들한테는비호감1위이고추한년은비호감2위려나
"지지율 1위 윤석열, 비호감 1위도 윤석열…秋 아슬아슬 2위 [리얼미터]",2021-04-13 21:16:00,2021-04-14 13:44:20,최****,윤석열 비호감도 1위 이유는 간단합니다. 저짝은 미워할 사람이 하도 넘쳐나니 비호감도가 분산되는거죠
"지지율 1위 윤석열, 비호감 1위도 윤석열…秋 아슬아슬 2위 [리얼미터]",2021-04-13 21:16:00,2021-04-14 10:30:49,tmch****,윤석열비호감 22.8% !이거 전혀 문제 안된다.얘들은 대깨문이거든!호감이든 비호감이든 윤석열을 절대 안찍을 사람들이니 무슨 상관이랴 !
"지지율 1위 윤석열, 비호감 1위도 윤석열…秋 아슬아슬 2위 [리얼미터]",2021-04-13 21:16:00,2021-04-14 10:24:00,lnig****,문재인도 포함시켰으면 압도적 압승인데. 비선호도 조사는
"지지율 1위 윤석열, 비호감 1위도 윤석열…秋 아슬아슬 2위 [리얼미터]",2021-04-13 21:16:00,2021-04-14 09:29:08,inma****,앞으로는 대통령 선거할 때 비호감인 사람에게 투표해서 꼴지 나온 사람을 당선 시키면 되겠네?? 바보도 아니고 무슨 여론 조작질이냐?
"지지율 1위 윤석열, 비호감 1위도 윤석열…秋 아슬아슬 2위 [리얼미터]",2021-04-13 21:16:00,2021-04-14 07:39:23,song****,관리자에 의해 삭제된 댓글입니다.
