제목,날짜,작성일,작성자,댓글
유승민 “술 담배 끊고 대선 준비…윤석열도 함께 경쟁을”,2021-04-01 11:00:00,2021-04-28 10:13:35,HP30****,이 땅이 오땅 한테 앵기면 가끔은 오땅이 죽는 수도 있다. 그러나 땅 잡고 죽으면 안되지라오. 다선끗짜리 잡으면 두끗 한테 눈치 긋발로 죽는 것은 많이 봤응게.
유승민 “술 담배 끊고 대선 준비…윤석열도 함께 경쟁을”,2021-04-01 11:00:00,2021-04-09 12:48:52,Luxy****,죽었다 깨어나도 쓰레기 같은 배신자 유승민 & 김무성은 절대 용서 못한다.
유승민 “술 담배 끊고 대선 준비…윤석열도 함께 경쟁을”,2021-04-01 11:00:00,2021-04-09 12:48:51,Luxy****,죽었다 깨어나도 쓰레기 같은 배신자 유승민 & 김무성은 절대 용서 못한다.
유승민 “술 담배 끊고 대선 준비…윤석열도 함께 경쟁을”,2021-04-01 11:00:00,2021-04-05 06:43:56,Chri****,"유승민, 유시민 ... 아주 이름만 들어도 구역질이 나는 이름들이다. 야 이 미친 놈아, 너같은 놈이 담배를 피우건, 마약을 해서 뒈 지 건 누구 눈하나나 깜짝을 한다고 숟가락들고 한 자리 낄려고 물구나무를 서냐? 넌 그저 대한민국이 회복되는 즉시로 광화문 이승만광장에 끌려나와 목이 잘려 효수될 놈이다. 엇다대고 3월 선거를 운운하느냐. 넌 그거 목을 늘이고 국민의 칼, 헌법의 칼, 대한민국의 칼을 받아야될 터이니, 그동안 버킷리스트나 충실히 채운 담에 목욕제계하고 기다리도록 하여라. 혹 칼로 목이 질겨서 잘 안 잘릴 때는, 거듭 말한다마는, 톱으로라도 썰어서 네놈의 더러운 목을 어깨로부터 분리시켜야된다고 모두를 벼르고 있다. 톱으로 써는 경우를 대비해서, 톱자루를 잡겠다는 지원자만도 수두룩하다는 것도 알아둬라. 천하에 못 된 반역 종자 잡종놈."
유승민 “술 담배 끊고 대선 준비…윤석열도 함께 경쟁을”,2021-04-01 11:00:00,2021-04-04 18:28:47,Hyun****,쓰레기 같은 종자
유승민 “술 담배 끊고 대선 준비…윤석열도 함께 경쟁을”,2021-04-01 11:00:00,2021-04-03 20:00:58,jjss****,"술 담배 ? / 처음 부터 아예 안 하면 , 대통령 되겠네 ????!!! 김 무승 이 하고 / 남자 끼리 키스 하는 장면을 매스콤에 내 보내지 마라 !!!!!!"
유승민 “술 담배 끊고 대선 준비…윤석열도 함께 경쟁을”,2021-04-01 11:00:00,2021-04-02 22:36:26,윤 ****,"중앙, 이놈 기사 제발 그만 올려라. 무슨 깜이되야 볼 생각이 나지 ."
유승민 “술 담배 끊고 대선 준비…윤석열도 함께 경쟁을”,2021-04-01 11:00:00,2021-04-02 15:03:22,hseo****,정권 바꾸려면 힘을 모을 생각을 해라. 안되는걸 자꾸 한다고 뭐가 나아지나?
유승민 “술 담배 끊고 대선 준비…윤석열도 함께 경쟁을”,2021-04-01 11:00:00,2021-04-02 14:01:05,JuYe****,제발 면상좀 안보게 꺼져주세요. 누가 당신을 찍는다고. 아직도 정신못차렸네
유승민 “술 담배 끊고 대선 준비…윤석열도 함께 경쟁을”,2021-04-01 11:00:00,2021-04-02 13:55:20,인****,유승 민 제발 가만이 있는게 도와주는것이다 국민의 힘은 유승민 의 유세장 나타날때마다 표 떨어지는소리가 나니 제발 가만이 있는게 도와주는거다
유승민 “술 담배 끊고 대선 준비…윤석열도 함께 경쟁을”,2021-04-01 11:00:00,2021-04-02 11:46:48,hhjs****,세상에 별넘이 다 있네! 대통령 될려고 술 담배 끊었다는 넘은 생전 처음본다!
유승민 “술 담배 끊고 대선 준비…윤석열도 함께 경쟁을”,2021-04-01 11:00:00,2021-04-02 10:46:21,Jiny****,미친사람들많네홍준표위시하여
유승민 “술 담배 끊고 대선 준비…윤석열도 함께 경쟁을”,2021-04-01 11:00:00,2021-04-02 10:23:33,ejss****,꼴값이 도를 넘어^^
유승민 “술 담배 끊고 대선 준비…윤석열도 함께 경쟁을”,2021-04-01 11:00:00,2021-04-02 09:54:54,h370****,윤씨는 벌써 나섰는데 뭘 함께야?.. ㅋ 묻어갈라고 하지마
유승민 “술 담배 끊고 대선 준비…윤석열도 함께 경쟁을”,2021-04-01 11:00:00,2021-04-01 23:37:50,윤 ****,"이 멍청한놈, 대구엔 얼씬도 못하고 ,전국구로 나온데......삶은 소대가리가 여기도 웃는다 ."
유승민 “술 담배 끊고 대선 준비…윤석열도 함께 경쟁을”,2021-04-01 11:00:00,2021-04-01 23:37:15,ogeu****,그 주둥이 처 다물고 꼬꾸라 저 있어라
유승민 “술 담배 끊고 대선 준비…윤석열도 함께 경쟁을”,2021-04-01 11:00:00,2021-04-01 23:33:05,윤 ****,"승민아! 너 지난번에 못깨우쳤냐? 국민학교, 미안, 초등학교 반장선거도 이따위론 안한다? 지난번에도 민주당 돕더니, 또 다시 민주당 이중대? 제발 아버님 이름에 먹칠하지 말길 바란다 ."
유승민 “술 담배 끊고 대선 준비…윤석열도 함께 경쟁을”,2021-04-01 11:00:00,2021-04-01 21:02:51,HP30****,"국민의 짐, 까마귀때 싸우는 곳에 윤석렬아 가지마라 평생 길러온 대한민국 법치주의 까마귀때들은 싫어하니 그동안 고결하게 지켜온 정신 더렵혀질까 하노라."
"김종인의 '대선 플랜B' 김동연, 정치도전 꺼내자 ""허허허""",2021-05-02 09:00:00,2021-05-02 20:51:59,윤****,김종인의 헛다리가 다시 정치판을 교란시키려한다. 그 나이 돼서도 오로지 자기 존재감에 목말라하는 꼴이 너무 추접한데 김종인의 끝은 어디일까
"김종인의 '대선 플랜B' 김동연, 정치도전 꺼내자 ""허허허""",2021-05-02 09:00:00,2021-05-02 18:05:23,오****,관리자에 의해 삭제된 댓글입니다.
"김종인의 '대선 플랜B' 김동연, 정치도전 꺼내자 ""허허허""",2021-05-02 09:00:00,2021-05-02 17:40:38,Paul****,깜량미달.
"김종인의 '대선 플랜B' 김동연, 정치도전 꺼내자 ""허허허""",2021-05-02 09:00:00,2021-05-02 16:07:41,2015****,"도대체 이 사람의 성과가 무엇인가? 행시 합격이 뭐가 그리 대단한가? 과거 1년에 두 번씩 치르던 암기력 경쟁 시험에 불과한 것이 아니었나? 그러니 야간대 출신도 합격하는 것이다. 아무튼 행시 출신들 중 엄청나게 멍청한 경우들이 많은 점은 알만한 사람들은 다 안다. 또 빈곤한 집안 출신이 자랑은 아니다. 결국 국민을 위해서 구체적으로 무엇을 했나를 실체적으로 따져야 한다. 물론 국민을 위한 공직 생활을 제대로 한 적이 없는 정당원들은 행시 출신의 고위직 인사를 높게 보겠지만, 미안하게도 행시 출신으로는 안 된다. 그들은 본질적으로 그냥 늘공일 뿐이다. 그러니 너무 기대하지 말라! 객관적으로 보면, 과거 ㅇㅊㅅ의 경우와 거의 유사한 현상일 뿐이다."
"김종인의 '대선 플랜B' 김동연, 정치도전 꺼내자 ""허허허""",2021-05-02 09:00:00,2021-05-02 14:57:29,정****,전라도의 배반 김종인 설치고 찔러보고 넘 날뛰네
"김종인의 '대선 플랜B' 김동연, 정치도전 꺼내자 ""허허허""",2021-05-02 09:00:00,2021-05-02 14:56:23,정****,야야 쫌상 너는 안된다
"김종인의 '대선 플랜B' 김동연, 정치도전 꺼내자 ""허허허""",2021-05-02 09:00:00,2021-05-02 13:40:50,유****,"이재명 이낙연 여당후보들이나 외골수 윤석열을 봐도 모두 우물안 개구리들 아닌가? 김동연이 처럼 상고를 나와 은행원, 야간대, 미시건이라도 경제학박사를 하고 글로벌경제 실무공직을 두루 겪고 대학총장 등 다양한 경험의 글로벌 플레이어를 찾기는 쉽지않다. 우리도 싱가폴이나 이스라엘처럼 영어 한가지라도 자유자재롭게 외국정상들과 껄껄거리며 교류를 할 줄아는 인물이 나와야 한다. 다만 쫑영감이 달라붙는다면 지저분해질까 우려되지만..."
"김종인의 '대선 플랜B' 김동연, 정치도전 꺼내자 ""허허허""",2021-05-02 09:00:00,2021-05-02 12:37:42,tick****,다 치우고 석열이 불러 ! 아따 성님 이제 뜸들어 갓지라. 숫가락 들고 맨 앞에서며... 꿀꺽... 형님 줄쓰셧네 이제 줄서 볼까... 아그들 깨워. 4
"김종인의 '대선 플랜B' 김동연, 정치도전 꺼내자 ""허허허""",2021-05-02 09:00:00,2021-05-02 12:03:21,novb****,"다 늙은 여우가 확실한 똘만이 새롭게 키우겠다는 음흉한 노욕, 늙은것이 토나온다. 제발 이제는 뒷방으로 꺼져라 좀!"
"김종인의 '대선 플랜B' 김동연, 정치도전 꺼내자 ""허허허""",2021-05-02 09:00:00,2021-05-02 11:32:21,aho9****,김종인이 킹 메이커냐?이번 선거 국민의힘이 잘한게 아니고 문재인에대한 분노여 김종이가 선거 승리한게아녀
"김종인의 '대선 플랜B' 김동연, 정치도전 꺼내자 ""허허허""",2021-05-02 09:00:00,2021-05-02 11:36:04,aho9****,이번 선거 김종인 보고 찍은 사람 있것냐?? 혼자 우쭐해서 붕떠서 문재인 사람들 찔러보냐?
"김종인의 '대선 플랜B' 김동연, 정치도전 꺼내자 ""허허허""",2021-05-02 09:00:00,2021-05-02 11:20:50,carl****,여시재 발동을 거는걸까
"김종인의 '대선 플랜B' 김동연, 정치도전 꺼내자 ""허허허""",2021-05-02 09:00:00,2021-05-02 11:15:41,star****,부총리로서 업적이 없고 소신없이 실패한 경제정책을 추인이나 하다가 쫒겨났는데 무슨 놈의 대선 후보?
"김종인의 '대선 플랜B' 김동연, 정치도전 꺼내자 ""허허허""",2021-05-02 09:00:00,2021-05-02 11:14:17,smil****,"윤석렬은 박대통령께 악행으로 민주를 이기지 못한다. 박대통령의 억울함을 알고있는 지지자들이 윤에게 적대가을 보이고 있고 현재도 30%의 지지율은 있다고 본다.젊은층은 떨어지겠지만. 그러니 정권창출하려면 탄핵과 무관한인사가 나올경우에는 가능하다 본다. 윤의 지지율에는 민주측의 작전표가 많은데 최근 호남의 지지가 이재명보다 높은게 그것으로 보인다. 그래서 민주는 윤이 나오길 바라고,윤이 나올경우 박대통령의 표를 갈라칠 방법을 민주는 알고있으니"
"김종인의 '대선 플랜B' 김동연, 정치도전 꺼내자 ""허허허""",2021-05-02 09:00:00,2021-05-02 11:11:27,thfr****,김종인의 정치전략은 현 정권에서 써먹고 버림받은 사람들이었네~~이 정도의 전략이라면 최하의 수준아닌가요?
"김종인의 '대선 플랜B' 김동연, 정치도전 꺼내자 ""허허허""",2021-05-02 09:00:00,2021-05-02 11:07:26,An10****,도대제 김동연이 한게 무엇인가? 현정권의 경제부총리 ? 과연 자기소신을 관철 시켰는가? 과감하게 현정권의 경제정책을 비판해보라~ 국민을 우습게 보는 사람들~ 윤석렬이나.김동연이나 정치를 모르는 사람들. 문정권보다 더 경험해보 지 못한 나라를 만들것이다. 경험과 경륜은 중요하다.
"김종인의 '대선 플랜B' 김동연, 정치도전 꺼내자 ""허허허""",2021-05-02 09:00:00,2021-05-02 11:07:13,Yj00****,"이곳저곳 기웃거리는 꼴라지가...추해 보인다....잠자코 있어야,물한컵이라도..얻어먹지..."
"김종인의 '대선 플랜B' 김동연, 정치도전 꺼내자 ""허허허""",2021-05-02 09:00:00,2021-05-02 10:49:07,geum****,"민생,계층 사다리... 그게 부자들을 위한 정당에서 가능한 야긴가..."
"김종인의 '대선 플랜B' 김동연, 정치도전 꺼내자 ""허허허""",2021-05-02 09:00:00,2021-05-02 10:39:54,hima****,흙수저 김동연--깡있는 근성 윤석열 합쳐라--나라 수렁에서 거져내야지--대신 홍준포/유승민/항교안--은 죽느게 애국이다---니들은 한국당 분열 시키자 마라
"김종인의 '대선 플랜B' 김동연, 정치도전 꺼내자 ""허허허""",2021-05-02 09:00:00,2021-05-02 10:16:44,shad****,이따위 하치 기사나 내면서 나같은 사람의 댓글은 용감하게 삭제하냐? 중앙일보가 나에게 감정이 많은가? 중앙일보! 좋은 기사를 쓰거라. 😡🤐🤐🤐🤐🤐🤐🤐🤐🤐🤐🤐🤬🤬🤬🤬🤬🤬🤬🤬🤬🤬🤬🤬🤬🤬🤬🤬🤬🤬🤬🤯🤯🤯🤯🤯
"유승민 ""윤석열·홍준표도 받아들여 대선 단일후보 뽑자""",2021-03-25 10:20:00,2021-04-13 20:29:21,HP30****,남에게 봉사 해 줄 일 있냐? 차라리 해외 봉사나 가시지.
"유승민 ""윤석열·홍준표도 받아들여 대선 단일후보 뽑자""",2021-03-25 10:20:00,2021-04-08 09:56:36,golf****,야권 단일후보로 정권은 꼭 심판해야 합니다!
"유승민 ""윤석열·홍준표도 받아들여 대선 단일후보 뽑자""",2021-03-25 10:20:00,2021-04-08 07:05:26,박재영/****,다른사람은 몰라도 승민이 너는 아니야 너가 한일을 아직도 모르겠어? 다시 숟가락 얹을려고 하지마라. 꼴보기 싫고 모양새도 안 좋다. 너가 그래도 정치라도 하고 네 이름이라도 갖고 있을려면 뒤에서 묵묵히 대권을 향해 뛰는사람을 무조건 도와라. 재 뿌리지는 말고...
"유승민 ""윤석열·홍준표도 받아들여 대선 단일후보 뽑자""",2021-03-25 10:20:00,2021-04-08 04:32:19,0sma****,유승민 니가 왜 거기서나와?너는 김무성과함께 문제인에게 정권넘기고 우파를 배신하고 가출한 우피를 이지경으로 내몰은 불량배 정치인 이잔아? 국민의힘에 민주당2중대놈들 많다 다 척결해야됨.
"유승민 ""윤석열·홍준표도 받아들여 대선 단일후보 뽑자""",2021-03-25 10:20:00,2021-03-26 12:41:22,방****,"승민아,정치권이네놈놀이터이더냐? 너는어떻게된것이,가끔하는지껄임이혼빠진소리만하냐?"
"유승민 ""윤석열·홍준표도 받아들여 대선 단일후보 뽑자""",2021-03-25 10:20:00,2021-03-26 11:32:49,jhle****,"유승민이 약속한 것치고 이루어진것이 하나도 없는데다가, 지지도가 늘 3%대 안밖이다. 그냥 가만히 있는게 상수다. 노자 가라사되, 無為함이 上手라."
"유승민 ""윤석열·홍준표도 받아들여 대선 단일후보 뽑자""",2021-03-25 10:20:00,2021-03-26 06:41:04,ino ****,예끼 유승민! 정권교체는 우파들이 연합하여 알아서 할테니 김무성과 김종인 데리고 무인도가서 아무말하지말고 조용히 사세요 좌우가 명확치 않은 당신들이 나서면 되던일도 안되요
"유승민 ""윤석열·홍준표도 받아들여 대선 단일후보 뽑자""",2021-03-25 10:20:00,2021-03-25 17:35:16,강****,지난 얘기로 더 이상 왈가불가하는 것 보다는 정권교체를 위해서는 유승민이든 홍준표든 안철수든 모두 힘을 합해 무슨 일이든 해야합니다. 또다시 이 정권이 반복되는 나라로 만들지 맙시다.
"유승민 ""윤석열·홍준표도 받아들여 대선 단일후보 뽑자""",2021-03-25 10:20:00,2021-03-25 16:43:27,isba****,유승민이 대권주자라고?삶은 소대가리가 웃겠다...ㅉㅉ
"유승민 ""윤석열·홍준표도 받아들여 대선 단일후보 뽑자""",2021-03-25 10:20:00,2021-03-25 15:52:20,moma****,"승민아 역적질 그만해라, 지금 국민의 힘을 힘들게 한 너는 배신의 죄를 지은 배신자여~"
"유승민 ""윤석열·홍준표도 받아들여 대선 단일후보 뽑자""",2021-03-25 10:20:00,2021-03-25 15:33:34,jaco****,유승민 의원 상식과 균형감각을 지니신 분입니다.
"유승민 ""윤석열·홍준표도 받아들여 대선 단일후보 뽑자""",2021-03-25 10:20:00,2021-03-25 14:40:26,Kyu ****,박근혜대통령을 배반한 년 놈들아 제발주둥아리 놀리지말고 정치일선에서 물러나라 🐕보다도 못하고 무능한 문재인보다못한 머리속빈 인간들아 앞으로도 자유민주주의 체제를 말아먹고싶으냐?
"유승민 ""윤석열·홍준표도 받아들여 대선 단일후보 뽑자""",2021-03-25 10:20:00,2021-03-25 14:18:56,daeh****,넌 빠지고.세상에제일 더러운 인간이 친구등에 칼꼿는 인간
"유승민 ""윤석열·홍준표도 받아들여 대선 단일후보 뽑자""",2021-03-25 10:20:00,2021-03-25 14:07:59,bsks****,관리자에 의해 삭제된 댓글입니다.
"유승민 ""윤석열·홍준표도 받아들여 대선 단일후보 뽑자""",2021-03-25 10:20:00,2021-03-25 13:45:40,Sung****,"유승민은 왜 홍준표를 끌어들이느냐, 그럼 김무성도 끌어들이게.. 이젠 이 사람들은 흥행을 시켜주는 것이 아니고 살아나는 불씨마저 끌 사람들이다. 이제는 유튜브 제작하면서 새로운 세대에 지원을 해줘라. 차라리 안철수 윤석렬 대결이 훨씬 낫ㄷ은"
"유승민 ""윤석열·홍준표도 받아들여 대선 단일후보 뽑자""",2021-03-25 10:20:00,2021-03-25 13:20:35,박****,유승민은 저큭성이너무없어 뒷북만..
"유승민 ""윤석열·홍준표도 받아들여 대선 단일후보 뽑자""",2021-03-25 10:20:00,2021-03-25 12:57:51,soul****,윤석열 총장 뒤에 왜 홍발정을 갖다 붙이냐?윤총장 밥상위에 숟가락 얻힐려 하지마라!유승민 김무성 홍발정 없어도 윤석열 총장이 대통령 되기로 다 나왔있어!
"유승민 ""윤석열·홍준표도 받아들여 대선 단일후보 뽑자""",2021-03-25 10:20:00,2021-03-25 12:28:02,qate****,"왜 국민들이 윤석열이에게 열광할까요? 이유는 하나 입니다. 민주당, 국민의 힘 등 여야를 막론하고 정치한다면서 철지난 사상논쟁이나 해대는 정치꾼들이게 질렸기 때문입니다. 윤석열이는 여야를 막론하고 신세 진적도 없고 오히려 썩을대로 썩은 정치꾼들 감옥에 보내 실적밖에 없습니다. 이번에 윤석열이가 대통령되면 아마 지난 4년간 대한민국을 수렁으로 빠뜨린 민주당 놈들 거의 대부분 감옥에 처넣어 주길 국민들은 바라고 있는 것이고 그간 정권 뺏기고 멍청한 야당 노릇을 하는 야당의원들도 이번에 옥석을 가려내고 대 청소를 해주길 바라기에 윤석열 지지율이 40퍼센트가 넘는 겁니다. 사실 민주당놈들이 이미 겁먹고 윤석열 깍아 내려고 평생 검사만 한 윤석열이 국가경영을 어찌하냐고 하는데 모지리 박근혜와 그보다 더 모지리 문재인도 대통령질 해먹는 나라가 대한민국입니다. 헌데 윤석열이가 대통령질 못해먹을 이유가 하나도 없는 겁니다. 아마 문재인이가 나라개조 한답시고 뒤집어 놓은 것 모두를 반대로만 해도 잘"
"유승민 ""윤석열·홍준표도 받아들여 대선 단일후보 뽑자""",2021-03-25 10:20:00,2021-03-25 12:30:12,qate****,한다고 성군소릴 들을 겁니다. 이에 더해서 국가에 빌붙어 먹는 수많은 기생충들이 국민의 의무를 다하게 하면서 좌파 쓰레기들만 다 쳐내도 5년후 성공한 대통령 칭송은 물론 한번 더 하라는 소리까지 듣게될 지 누가 알겠습니까?
“국힘 경선 이기면 吳처럼…” 용기 얻는 유승민·원희룡·김태호,2021-04-14 05:00:00,2021-04-27 17:13:07,Yj00****,니들은 어렵다고 생갓 한다...윤석열과안철수의 조합으로...런닝메이트로 하면...윤석열의 승리가 보인다..
“국힘 경선 이기면 吳처럼…” 용기 얻는 유승민·원희룡·김태호,2021-04-14 05:00:00,2021-04-15 17:58:45,jys0****,떡줄 사람들은 생각도 않는데 참 착각도 병이다 저런 모지리들 좀 안 보고 살고싶다
“국힘 경선 이기면 吳처럼…” 용기 얻는 유승민·원희룡·김태호,2021-04-14 05:00:00,2021-04-15 12:06:57,강****,국민의힘으론절대대선승리못한다정리할자정리하고새판짜야된다보수들이민주당찍으면찍었지현재국힘에누가나와도안찍는다한다특히두사람또62명그들이보수망쳐놓고또찍어달라미쳤냐고한다제대로해라모두함량미달이다국민의힘을보수국민의적이라한다인간말종들이너무많다서울시장하고는다르다
“국힘 경선 이기면 吳처럼…” 용기 얻는 유승민·원희룡·김태호,2021-04-14 05:00:00,2021-04-15 06:37:04,Hyan****,원희룡.제주에서 므슨짓한거야.중공놈들에게 제주땅 팔아 망쳐논거아니냐. 유승민은말할가치없고.빌어먹을놈들
“국힘 경선 이기면 吳처럼…” 용기 얻는 유승민·원희룡·김태호,2021-04-14 05:00:00,2021-04-14 11:42:19,김****,문재인의 동업자 유승민과 김무성 이 두놈과 탄핵찬성파들이 다시 정계에 발을 못붙이게 해야한다!
“국힘 경선 이기면 吳처럼…” 용기 얻는 유승민·원희룡·김태호,2021-04-14 05:00:00,2021-04-14 11:42:02,hong****,아니 ㅋㅋ 오세훈이 인기가 많아서 뽑혔겠냐? 정권심판 때문에 뽑힌거지~ 정신을 못차렸구만 ㅋㅋ 유승민은 너가 오세훈처럼 될수 있다는 착각 그만해라~ 오세훈은 그래도 시정능력 경험이 있어서 뽑아준거다~
“국힘 경선 이기면 吳처럼…” 용기 얻는 유승민·원희룡·김태호,2021-04-14 05:00:00,2021-04-14 10:54:02,jeon****,유승민놈 내부에적이 제일나쁜놈이다~~
“국힘 경선 이기면 吳처럼…” 용기 얻는 유승민·원희룡·김태호,2021-04-14 05:00:00,2021-04-14 10:47:59,rmsd****,쓰레기 소각장에 불났다는 말이다. 오세훈이 역선택을 받아 문정부 싫어하는 사람들이 할수없이 찍어준걸 반복해 보겠다는 황당한 발상에 쓰레기들이 다시 설치겠다는 말인가 . 그래서 윤석열이 국민의 힘에 들어가면 안된다. 차라리 윤석열이 민주당에 들어가 진짜 개혁을 해보면 어떨까 지지율이 순식간에 50%는 넘을거 같은데 지지율 5%도 안되는 쓰레기들 청소될때까지 국민의 힘은 생각도 말라.
“국힘 경선 이기면 吳처럼…” 용기 얻는 유승민·원희룡·김태호,2021-04-14 05:00:00,2021-04-14 10:16:45,Echo****,건달 정치꾼들은 나대지 말고 집에서 속죄하고 있거라. 그리고 안철수는 정치건달들이 운신하지 못하도록 조만간 힘당과 합당해라. 곧 있을 전당대회 당 대표 선출에 나서 대표직을 맡아라. 1백프로 거머쥔다. 이후 6월께 윤석열을 비롯한 원외인 나경원 최재형(현 감사원장)원희룡을 불러들여 대권 몰이에 나서라. 2022년 3월까지 안철수는 정국을 주도하며 국민의 힘 열풍을 내내 일으킬 것이다. 중도 온건 보수 20대~30대~50대들이 안철수의 길을 함께한다. 지켜보겠다.
“국힘 경선 이기면 吳처럼…” 용기 얻는 유승민·원희룡·김태호,2021-04-14 05:00:00,2021-04-14 10:10:36,7whv****,"전부다 대통령이 되고 싶어 안달이 났구나! 더듬어당은 야권의 분열을 노리고 있는거 모르니, 오합지졸 되는 경선 하지 말고 대통령 될 강력한 한 사람을 추대해서 정세균이나 이재명이 올라오면 싸워야 승산이 있는데 벌써부터 저 얍삽한 유승민 같은 인간이 나오게 된다면 분명 필패할거다."
“국힘 경선 이기면 吳처럼…” 용기 얻는 유승민·원희룡·김태호,2021-04-14 05:00:00,2021-04-14 09:52:55,soul****,박근혜를 탄핵해서 들어선 정권이 연산군보다 못하다고 문산군이라 하는데 봐라 영국은 집단 면역에 성공해서 마스크 벗었잖아.건데 우리나라는 백신 확보는 커녕 백신 종류도 정하지 못하고 갈팡질팡 하잖아.다른 나라들은 국가원수가 나서서 총력을 기울일 때에 우리나라는 집권내내 검찰개혁 윤총장 징계 정직에만 신경썼으니 이제 확진자가 하루 300명 대에서 5~600명대로 늘어나도 뽀족한 수가 없네.새로 큰별을 기다리지 이정권 탄생에 일조하여 탄핵에 앞장섰던 도토리들은 빠져.혐오스럽단 말이다.
“국힘 경선 이기면 吳처럼…” 용기 얻는 유승민·원희룡·김태호,2021-04-14 05:00:00,2021-04-14 08:55:42,강****,배신자 유승민과 김무성이 설치는 국힘당 싫다 싫어
“국힘 경선 이기면 吳처럼…” 용기 얻는 유승민·원희룡·김태호,2021-04-14 05:00:00,2021-04-14 10:57:26,gony****,본인도 유승민 김무성 등 배신자들은 꼴도 보기 싫네요.
“국힘 경선 이기면 吳처럼…” 용기 얻는 유승민·원희룡·김태호,2021-04-14 05:00:00,2021-04-14 08:52:56,bsks****,관리자에 의해 삭제된 댓글입니다.
“국힘 경선 이기면 吳처럼…” 용기 얻는 유승민·원희룡·김태호,2021-04-14 05:00:00,2021-04-14 08:46:16,gyn4****,"떡줄 사람은 생각도 안하고 있는데, 김치국물이나 먼저 마시고 있는 떨거지들. 이러니 너네들이 안되는 거야. 한심한 인간들이 하나 둘이 아니다."
“국힘 경선 이기면 吳처럼…” 용기 얻는 유승민·원희룡·김태호,2021-04-14 05:00:00,2021-04-14 08:33:43,gurq****,유승민이는 하늘이 두쪽나도 안된다. 배신자만은 절대 용서하지말자.
“국힘 경선 이기면 吳처럼…” 용기 얻는 유승민·원희룡·김태호,2021-04-14 05:00:00,2021-04-14 07:58:30,galm****,유승민 이 인간 쓰레기는 왜 자꾸 띄우나. 연금개혁의 기회를 날려버린 매국노를 무슨 이유로 중앙은 띄우나.
“국힘 경선 이기면 吳처럼…” 용기 얻는 유승민·원희룡·김태호,2021-04-14 05:00:00,2021-04-14 07:39:19,Paul****,".잠룡아닌, 잡종들에게 매서운 조소룰 보내노라.."
